{
  "obligation_id": "0192f3a1-7b2c-7d4e-8f90-300000000001",
  "request_id": "0192f3a1-7b2c-7d4e-8f90-800000000001",
  "idempotency_key": "0192f3a1-7b2c-7d4e-8f90-830000000001",
  "unit_ids": [
    "0192f3a1-7b2c-7d4e-8f90-400000000001",
    "0192f3a1-7b2c-7d4e-8f90-400000000002"
  ],
  "target_clinic_id": 2,
  "patient_case_sealed": "v1.k1-2026-10.Q2lwaGVydGV4dC1kZW1vLW5vdC1yZWFs"
}
